{
  "schema": "garment-spec/v1",
  "addr": "sport-coat > lapel > lapel-width > lw-50",
  "productId": "sport-coat",
  "sectionId": "lapel",
  "fieldId": "lapel-width",
  "optionId": "lw-50",
  "sourceFile": "C:\\Users\\ChaseStanley\\Downloads\\files\\brand_assets\\blessed-dressed\\data-store\\options\\sport-coat.json",
  "source": "json",
  "label": "5.0 cm",
  "description": "Narrow — modern slim contemporary.",
  "fieldLabel": "Lapel Width",
  "sectionLabel": "Lapel",
  "part": "jacket-lapel",
  "garment": {
    "noun": "bespoke sport coat",
    "fabric": "textured wool/hopsack with visible weave"
  },
  "view": {
    "orientation": "front",
    "wearerPerspective": true,
    "confirmedByVisualInspection": true
  },
  "absence": false,
  "measured": {
    "dimensions": [
      "5.0 cm"
    ],
    "angles": [],
    "counts": [],
    "shapes": [],
    "negatedShapes": [],
    "spread": [
      "narrow spread"
    ],
    "flags": [],
    "sides": [],
    "attributes": [],
    "supplierCodes": [],
    "unresolved": []
  },
  "illustration": {
    "path": "/images/blueprints/baoxiniao/jacket/KFABL/A.jpg",
    "disk": "C:\\Users\\ChaseStanley\\Downloads\\files\\brand_assets\\blessed-dressed\\public\\images\\blueprints\\baoxiniao\\jacket\\KFABL\\A.jpg",
    "exists": true,
    "remote": false
  },
  "forbidden": [
    "a generic version of this part standing in for the exact drawn option (generic-category substitution)",
    "any feature, count, or geometry borrowed from a neighboring craft option on the same field",
    "a feature that belongs on the opposite face of the garment from what this illustration shows (front/back/side confusion)"
  ],
  "excluded": null,
  "generate": true,
  "extractedAt": "2026-08-26T07:28:36.351Z"
}
