{
  "schema": "garment-spec/v1",
  "addr": "suit-2pc > Trousers-back > back-pocket-style > back-both-welt",
  "productId": "suit-2pc",
  "sectionId": "Trousers-back",
  "fieldId": "back-pocket-style",
  "optionId": "back-both-welt",
  "sourceFile": "C:\\Users\\ChaseStanley\\Downloads\\files\\brand_assets\\blessed-dressed\\data-store\\options\\suit-2pc.json",
  "source": "json",
  "label": "Both Welt Pockets (Left Button)",
  "description": "Both sides welt with button.",
  "fieldLabel": "Back Pocket Style",
  "sectionLabel": "Trousers — Back",
  "part": "jacket-detail",
  "garment": {
    "noun": "navy bespoke suit jacket",
    "fabric": "fine wool suiting with visible weave"
  },
  "view": {
    "orientation": "back",
    "wearerPerspective": true,
    "confirmedByVisualInspection": true
  },
  "absence": false,
  "measured": {
    "dimensions": [],
    "angles": [],
    "counts": [],
    "shapes": [
      "jetted / besom welt",
      "welt pocket"
    ],
    "spread": [],
    "flags": [
      "collar/closure button"
    ]
  },
  "illustration": {
    "path": "/images/blueprints/factory/819f9d468b2d__320B__Right_left_besom_left_bttn.jpg",
    "disk": "C:\\Users\\ChaseStanley\\Downloads\\files\\brand_assets\\blessed-dressed\\public\\images\\blueprints\\factory\\819f9d468b2d__320B__Right_left_besom_left_bttn.jpg",
    "exists": true,
    "remote": false
  },
  "forbidden": [
    "a generic version of this part standing in for the exact drawn option (generic-category substitution)",
    "any feature, count, or geometry borrowed from a neighboring craft option on the same field",
    "a feature that belongs on the opposite face of the garment from what this illustration shows (front/back/side confusion)"
  ],
  "excluded": null,
  "generate": true,
  "extractedAt": "2026-07-31T04:39:47.822Z"
}
