{
  "schema": "garment-spec/v1",
  "addr": "suit-2pc > Trousers-front-pockets > pocket-knot > knot-i",
  "productId": "suit-2pc",
  "sectionId": "Trousers-front-pockets",
  "fieldId": "pocket-knot",
  "optionId": "knot-i",
  "sourceFile": "C:\\Users\\ChaseStanley\\Downloads\\files\\brand_assets\\blessed-dressed\\data-store\\options\\suit-2pc.json",
  "source": "json",
  "label": "I-Shape Bartack",
  "description": "Standard I-shaped reinforcement tack at pocket.",
  "fieldLabel": "Pocket Bartack Style",
  "sectionLabel": "Trousers — Front & Pockets",
  "part": "fin-stitch",
  "garment": {
    "noun": "pair of bespoke wool tailored trousers",
    "fabric": "fine wool trouser cloth with visible weave"
  },
  "view": {
    "orientation": "detail",
    "wearerPerspective": true,
    "confirmedByVisualInspection": true
  },
  "absence": false,
  "measured": {
    "dimensions": [],
    "angles": [],
    "counts": [],
    "shapes": [],
    "negatedShapes": [],
    "spread": [],
    "flags": []
  },
  "illustration": {
    "path": "/images/blueprints/remote/cc2d765f6c59__167843791093474.png",
    "disk": "C:\\Users\\ChaseStanley\\Downloads\\files\\brand_assets\\blessed-dressed\\public\\images\\blueprints\\remote\\cc2d765f6c59__167843791093474.png",
    "exists": true,
    "remote": false
  },
  "forbidden": [
    "a generic version of this part standing in for the exact drawn option (generic-category substitution)",
    "any feature, count, or geometry borrowed from a neighboring craft option on the same field",
    "a feature that belongs on the opposite face of the garment from what this illustration shows (front/back/side confusion)"
  ],
  "excluded": null,
  "generate": true,
  "extractedAt": "2026-08-02T06:02:48.500Z"
}
