{
  "schema": "garment-spec/v1",
  "addr": "suit-3pc > Trousers-waistband > waistband-extension > ext-round-dbl-hooks",
  "productId": "suit-3pc",
  "sectionId": "Trousers-waistband",
  "fieldId": "waistband-extension",
  "optionId": "ext-round-dbl-hooks",
  "sourceFile": "C:\\Users\\ChaseStanley\\Downloads\\files\\brand_assets\\blessed-dressed\\data-store\\options\\suit-3pc.json",
  "source": "json",
  "label": "Round, Double Hooks",
  "description": "Rounded tab with two hooks.",
  "fieldLabel": "Extension & Closure",
  "sectionLabel": "Trousers — Waistband",
  "part": "trouser-extension",
  "garment": {
    "noun": "pair of bespoke wool tailored trousers",
    "fabric": "fine wool trouser cloth with visible weave"
  },
  "view": {
    "orientation": "front",
    "wearerPerspective": true,
    "confirmedByVisualInspection": true
  },
  "absence": false,
  "measured": {
    "dimensions": [],
    "angles": [],
    "counts": [
      "2-hook"
    ],
    "shapes": [
      "rounded extension tab"
    ],
    "negatedShapes": [],
    "spread": [],
    "flags": [
      "tab fastening",
      "hook-only closure"
    ],
    "sides": [],
    "attributes": [],
    "supplierCodes": [],
    "unresolved": []
  },
  "illustration": {
    "path": "/images/blueprints/remote/15cce2379001__342R.jpg",
    "disk": "C:\\Users\\ChaseStanley\\Downloads\\files\\brand_assets\\blessed-dressed\\public\\images\\blueprints\\remote\\15cce2379001__342R.jpg",
    "exists": true,
    "remote": false
  },
  "forbidden": [
    "a generic version of this part standing in for the exact drawn option (generic-category substitution)",
    "any feature, count, or geometry borrowed from a neighboring craft option on the same field",
    "a feature that belongs on the opposite face of the garment from what this illustration shows (front/back/side confusion)",
    "any hook count other than exactly 2"
  ],
  "excluded": null,
  "generate": true,
  "extractedAt": "2026-08-27T02:36:39.322Z"
}
