{
  "schema": "garment-spec/v1",
  "addr": "suit-3pc > Trousers-front-pockets > watch-pocket > watch-both",
  "productId": "suit-3pc",
  "sectionId": "Trousers-front-pockets",
  "fieldId": "watch-pocket",
  "optionId": "watch-both",
  "sourceFile": "C:\\Users\\ChaseStanley\\Downloads\\files\\brand_assets\\blessed-dressed\\data-store\\options\\suit-3pc.json",
  "source": "json",
  "label": "Both Sides",
  "description": "Watch pockets on both sides — twin utility chambers mounted inside the waistband in balanced symmetry.",
  "fieldLabel": "Watch Pocket",
  "sectionLabel": "Trousers — Front & Pockets",
  "part": "trouser-small-pocket",
  "garment": {
    "noun": "pair of bespoke wool tailored trousers",
    "fabric": "fine wool trouser cloth with visible weave"
  },
  "view": {
    "orientation": "front",
    "wearerPerspective": true,
    "confirmedByVisualInspection": true
  },
  "absence": false,
  "measured": {
    "dimensions": [],
    "angles": [],
    "counts": [],
    "shapes": [
      "watch pocket"
    ],
    "negatedShapes": [],
    "spread": [],
    "flags": [],
    "sides": [
      "both",
      "inside"
    ],
    "attributes": [],
    "supplierCodes": [],
    "unresolved": []
  },
  "illustration": {
    "path": "/images/blueprints/factory/88f95280e442__3532__Left_right.jpg",
    "disk": "C:\\Users\\ChaseStanley\\Downloads\\files\\brand_assets\\blessed-dressed\\public\\images\\blueprints\\factory\\88f95280e442__3532__Left_right.jpg",
    "exists": true,
    "remote": false
  },
  "forbidden": [
    "a generic version of this part standing in for the exact drawn option (generic-category substitution)",
    "any feature, count, or geometry borrowed from a neighboring craft option on the same field",
    "a feature that belongs on the opposite face of the garment from what this illustration shows (front/back/side confusion)"
  ],
  "excluded": null,
  "generate": true,
  "extractedAt": "2026-08-27T02:36:43.760Z"
}
