{
  "schema": "garment-spec/v1",
  "addr": "shirt > collar > lapel > collar-point-70",
  "productId": "shirt",
  "sectionId": "collar",
  "fieldId": "lapel",
  "optionId": "collar-point-70",
  "sourceFile": "C:\\Users\\ChaseStanley\\Downloads\\files\\brand_assets\\blessed-dressed\\data-store\\options\\shirt.json",
  "source": "json",
  "label": "Point 7.0 cm",
  "description": "The classic Point collar at 7.0cm is the most timeless of dress shirt collars — moderate in length, with a slight downward angle that suits a wide range of face shapes and tie knots. It occupies the sweet spot between the long traditional point and the casual button-down, lending a shirt a polished formality without appearing severe. This collar stands well against a jacket lapel and is the standard choice for most bespoke shirtmakers seeking understated elegance.",
  "fieldLabel": "Collar Style",
  "sectionLabel": "Collar",
  "part": "shirt-collar",
  "garment": {
    "noun": "white bespoke cotton dress shirt",
    "fabric": "crisp cotton poplin"
  },
  "view": {
    "orientation": "detail",
    "wearerPerspective": true,
    "confirmedByVisualInspection": true
  },
  "absence": false,
  "measured": {
    "dimensions": [
      "7.0 cm"
    ],
    "angles": [],
    "counts": [],
    "shapes": [
      "button-down point",
      "point"
    ],
    "spread": [],
    "flags": []
  },
  "illustration": {
    "path": "/images/ai/collar-point-70.png",
    "disk": "C:\\Users\\ChaseStanley\\Downloads\\files\\brand_assets\\blessed-dressed\\public\\images\\ai\\collar-point-70.png",
    "exists": true,
    "remote": false
  },
  "forbidden": [
    "a generic version of this part standing in for the exact drawn option (generic-category substitution)",
    "any feature, count, or geometry borrowed from a neighboring craft option on the same field",
    "a feature that belongs on the opposite face of the garment from what this illustration shows (front/back/side confusion)",
    "collar leaves ending in a squared/blunt flat edge, or in a rounded club tip — this option's collar point termination is a straight acute point"
  ],
  "excluded": null,
  "generate": true,
  "extractedAt": "2026-07-28T05:12:33.122Z"
}
