{
  "schema": "garment-spec/v1",
  "addr": "shirt > labels > brand_label_position > blp-1",
  "productId": "shirt",
  "sectionId": "labels",
  "fieldId": "brand_label_position",
  "optionId": "blp-1",
  "sourceFile": "C:\\Users\\ChaseStanley\\Downloads\\files\\brand_assets\\blessed-dressed\\data-store\\options\\shirt.json",
  "source": "json",
  "label": "Position 1",
  "description": "Brand label position option 1.",
  "fieldLabel": "Brand Label Position",
  "sectionLabel": "Labels",
  "part": "fin-label",
  "garment": {
    "noun": "white bespoke cotton dress shirt",
    "fabric": "crisp cotton poplin"
  },
  "view": {
    "orientation": "front",
    "wearerPerspective": true,
    "confirmedByVisualInspection": true
  },
  "absence": false,
  "measured": {
    "dimensions": [],
    "angles": [],
    "counts": [],
    "shapes": [],
    "negatedShapes": [],
    "spread": [],
    "flags": [],
    "sides": [],
    "attributes": [],
    "supplierCodes": [],
    "unresolved": []
  },
  "illustration": {
    "path": "/images/brand_label_position/picture-1112.jpg",
    "disk": "C:\\Users\\ChaseStanley\\Downloads\\files\\brand_assets\\blessed-dressed\\public\\images\\brand_label_position\\picture-1112.jpg",
    "exists": true,
    "remote": false
  },
  "forbidden": [
    "a generic version of this part standing in for the exact drawn option (generic-category substitution)",
    "any feature, count, or geometry borrowed from a neighboring craft option on the same field",
    "a feature that belongs on the opposite face of the garment from what this illustration shows (front/back/side confusion)"
  ],
  "excluded": null,
  "generate": true,
  "extractedAt": "2026-08-27T02:37:27.193Z"
}
