{
  "schema": "garment-spec/v1",
  "addr": "sport-coat > suit-pockets > lower-pocket-bartack > bartack-d",
  "productId": "sport-coat",
  "sectionId": "suit-pockets",
  "fieldId": "lower-pocket-bartack",
  "optionId": "bartack-d",
  "sourceFile": "C:\\Users\\ChaseStanley\\Downloads\\files\\brand_assets\\blessed-dressed\\data-store\\options\\sport-coat.json",
  "source": "json",
  "label": "D-Bartack",
  "description": "The D-shaped bartack is a half-moon or D-profile reinforcement stitch placed at the top corners of a pocket opening, its curved outer edge following the stress line where the pocket mouth meets the face cloth. The D-form distributes tension across a larger arc than a linear bar tack, making it particularly effective on heavier cloths and working pockets subject to repeated use. In bespoke tailoring it is regarded as a refined functional detail that, because of its decorative curved shape, is visible and intentional without looking merely utilitarian.",
  "fieldLabel": "Pocket Bartack",
  "sectionLabel": "Pockets",
  "part": "jacket-pocket",
  "garment": {
    "noun": "bespoke sport coat",
    "fabric": "textured wool/hopsack with visible weave"
  },
  "view": {
    "orientation": "front",
    "wearerPerspective": true,
    "confirmedByVisualInspection": true
  },
  "absence": false,
  "measured": {
    "dimensions": [],
    "angles": [],
    "counts": [],
    "shapes": [
      "arc buttonhole"
    ],
    "negatedShapes": [],
    "spread": [],
    "flags": [],
    "sides": [
      "outside",
      "upper"
    ],
    "attributes": [],
    "supplierCodes": [],
    "unresolved": []
  },
  "illustration": {
    "path": "/images/blueprints/baoxiniao/jacket/REKPO/A.jpg",
    "disk": "C:\\Users\\ChaseStanley\\Downloads\\files\\brand_assets\\blessed-dressed\\public\\images\\blueprints\\baoxiniao\\jacket\\REKPO\\A.jpg",
    "exists": true,
    "remote": false
  },
  "forbidden": [
    "a generic version of this part standing in for the exact drawn option (generic-category substitution)",
    "any feature, count, or geometry borrowed from a neighboring craft option on the same field",
    "a feature that belongs on the opposite face of the garment from what this illustration shows (front/back/side confusion)"
  ],
  "excluded": null,
  "generate": true,
  "extractedAt": "2026-08-26T07:28:39.994Z"
}
