{
  "schema": "garment-spec/v1",
  "addr": "sport-coat > suit-details > columbia-piping > cp-piping",
  "productId": "sport-coat",
  "sectionId": "suit-details",
  "fieldId": "columbia-piping",
  "optionId": "cp-piping",
  "sourceFile": "C:\\Users\\ChaseStanley\\Downloads\\files\\brand_assets\\blessed-dressed\\data-store\\options\\sport-coat.json",
  "source": "json",
  "label": "Piping",
  "description": "Interior piping trim.",
  "fieldLabel": "Interior Columbia Stitching / Piping",
  "sectionLabel": "Details & Stitching",
  "part": "fin-piping",
  "garment": {
    "noun": "bespoke sport coat",
    "fabric": "textured wool/hopsack with visible weave"
  },
  "view": {
    "orientation": "front",
    "wearerPerspective": true,
    "confirmedByVisualInspection": true
  },
  "absence": false,
  "measured": {
    "dimensions": [],
    "angles": [],
    "counts": [],
    "shapes": [],
    "negatedShapes": [],
    "spread": [],
    "flags": [],
    "sides": [
      "inside"
    ],
    "attributes": [],
    "supplierCodes": [],
    "unresolved": []
  },
  "illustration": {
    "path": "/images/blueprints/baoxiniao/jacket/GTEZB/C.jpg",
    "disk": "C:\\Users\\ChaseStanley\\Downloads\\files\\brand_assets\\blessed-dressed\\public\\images\\blueprints\\baoxiniao\\jacket\\GTEZB\\C.jpg",
    "exists": true,
    "remote": false
  },
  "forbidden": [
    "a generic version of this part standing in for the exact drawn option (generic-category substitution)",
    "any feature, count, or geometry borrowed from a neighboring craft option on the same field",
    "a feature that belongs on the opposite face of the garment from what this illustration shows (front/back/side confusion)"
  ],
  "excluded": null,
  "generate": true,
  "extractedAt": "2026-08-26T07:28:18.674Z"
}
