{
  "schema": "garment-spec/v1",
  "addr": "shirt > back-structure > back > back-side-pleats-dbl-darts",
  "productId": "shirt",
  "sectionId": "back-structure",
  "fieldId": "back",
  "optionId": "back-side-pleats-dbl-darts",
  "sourceFile": "C:\\Users\\ChaseStanley\\Downloads\\files\\brand_assets\\blessed-dressed\\data-store\\options\\shirt.json",
  "source": "json",
  "label": "Side Pleats with Double Darts",
  "description": "Side pleats with double darts combine rear knife pleats near the shoulder blades with two shaping darts lower down the back. The pleats add ease across the upper back while the darts nip in the waist, giving both comfort up top and a tapered fit below. This hybrid back offers movement and a tailored silhouette at once.",
  "fieldLabel": "Back Style",
  "sectionLabel": "Back & Structure",
  "part": "shirt-back",
  "garment": {
    "noun": "white bespoke cotton dress shirt",
    "fabric": "crisp cotton poplin"
  },
  "view": {
    "orientation": "back",
    "wearerPerspective": true,
    "confirmedByVisualInspection": true
  },
  "absence": false,
  "measured": {
    "dimensions": [],
    "angles": [],
    "counts": [],
    "shapes": [],
    "negatedShapes": [],
    "spread": [],
    "flags": [],
    "sides": [
      "both",
      "back",
      "upper",
      "lower"
    ],
    "attributes": [],
    "supplierCodes": [],
    "unresolved": []
  },
  "illustration": {
    "path": "/images/back/side-pleats-with-double-darts.jpg",
    "disk": "C:\\Users\\ChaseStanley\\Downloads\\files\\brand_assets\\blessed-dressed\\public\\images\\back\\side-pleats-with-double-darts.jpg",
    "exists": true,
    "remote": false
  },
  "forbidden": [
    "a generic version of this part standing in for the exact drawn option (generic-category substitution)",
    "any feature, count, or geometry borrowed from a neighboring craft option on the same field",
    "a feature that belongs on the opposite face of the garment from what this illustration shows (front/back/side confusion)"
  ],
  "excluded": null,
  "generate": true,
  "extractedAt": "2026-08-11T02:48:17.728Z"
}
