{
  "schema": "garment-spec/v1",
  "addr": "suit-2pc > Trousers-front-pockets > watch-pocket > watch-left",
  "productId": "suit-2pc",
  "sectionId": "Trousers-front-pockets",
  "fieldId": "watch-pocket",
  "optionId": "watch-left",
  "sourceFile": "C:\\Users\\ChaseStanley\\Downloads\\files\\brand_assets\\blessed-dressed\\data-store\\options\\suit-2pc.json",
  "source": "json",
  "label": "Left Welt",
  "description": "Watch pocket on the left — a rare placement that reads immediately custom, with deliberate visual asymmetry.",
  "fieldLabel": "Watch Pocket",
  "sectionLabel": "Trousers — Front & Pockets",
  "part": "trouser-detail",
  "garment": {
    "noun": "pair of bespoke wool tailored trousers",
    "fabric": "fine wool trouser cloth with visible weave"
  },
  "view": {
    "orientation": "three-quarter-front",
    "wearerPerspective": true,
    "confirmedByVisualInspection": true
  },
  "absence": false,
  "measured": {
    "dimensions": [],
    "angles": [],
    "counts": [],
    "shapes": [
      "welt pocket"
    ],
    "negatedShapes": [],
    "spread": [],
    "flags": []
  },
  "illustration": {
    "path": "/images/blueprints/factory/2a5f7a6c70e1__3171__Left_welt.jpg",
    "disk": "C:\\Users\\ChaseStanley\\Downloads\\files\\brand_assets\\blessed-dressed\\public\\images\\blueprints\\factory\\2a5f7a6c70e1__3171__Left_welt.jpg",
    "exists": true,
    "remote": false
  },
  "forbidden": [
    "a generic version of this part standing in for the exact drawn option (generic-category substitution)",
    "any feature, count, or geometry borrowed from a neighboring craft option on the same field",
    "a feature that belongs on the opposite face of the garment from what this illustration shows (front/back/side confusion)"
  ],
  "excluded": null,
  "generate": true,
  "extractedAt": "2026-08-01T21:53:32.944Z"
}
