{
  "schema": "garment-spec/v1",
  "addr": "sport-coat > interior > facing-style > facing-5",
  "productId": "sport-coat",
  "sectionId": "interior",
  "fieldId": "facing-style",
  "optionId": "facing-5",
  "sourceFile": "C:\\Users\\ChaseStanley\\Downloads\\files\\brand_assets\\blessed-dressed\\data-store\\options\\sport-coat.json",
  "source": "json",
  "label": "Facing 5",
  "description": "Full facing — traditional standard.",
  "fieldLabel": "Facing Style",
  "sectionLabel": "Interior & Facing",
  "part": "fin-lining",
  "garment": {
    "noun": "bespoke sport coat",
    "fabric": "textured wool/hopsack with visible weave"
  },
  "view": {
    "orientation": "interior",
    "wearerPerspective": true,
    "confirmedByVisualInspection": true
  },
  "absence": false,
  "measured": {
    "dimensions": [],
    "angles": [],
    "counts": [],
    "shapes": [],
    "negatedShapes": [],
    "spread": [],
    "flags": [],
    "sides": [],
    "attributes": [],
    "supplierCodes": [],
    "unresolved": []
  },
  "illustration": {
    "path": "/images/blueprints/baoxiniao/jacket/KINGM/A.jpg",
    "disk": "C:\\Users\\ChaseStanley\\Downloads\\files\\brand_assets\\blessed-dressed\\public\\images\\blueprints\\baoxiniao\\jacket\\KINGM\\A.jpg",
    "exists": true,
    "remote": false
  },
  "forbidden": [
    "a generic version of this part standing in for the exact drawn option (generic-category substitution)",
    "any feature, count, or geometry borrowed from a neighboring craft option on the same field",
    "a feature that belongs on the opposite face of the garment from what this illustration shows (front/back/side confusion)"
  ],
  "excluded": null,
  "generate": true,
  "extractedAt": "2026-08-26T07:28:13.245Z"
}
