{
  "schema": "garment-spec/v1",
  "addr": "sport-coat > sleeves-cuffs > cuff-style > cuff-angled",
  "productId": "sport-coat",
  "sectionId": "sleeves-cuffs",
  "fieldId": "cuff-style",
  "optionId": "cuff-angled",
  "sourceFile": "C:\\Users\\ChaseStanley\\Downloads\\files\\brand_assets\\blessed-dressed\\data-store\\options\\sport-coat.json",
  "source": "json",
  "label": "Angled Vent Cuff",
  "description": "The angled vent cuff is cut with a slight diagonal slant — typically dropping at the outer edge — so that when the arm hangs naturally, the cuff line follows the pitch of the wrist rather than sitting perfectly horizontal. This tailoring detail is common in English and Italian bespoke houses and serves both an aesthetic and ergonomic function: it allows a cleaner drape of the sleeve at the arm's natural angle and often better reveals a shirt cuff when the elbow is slightly bent. The result is a more animated, dynamic end to the sleeve compared to the static formality of a square cut.",
  "fieldLabel": "Sleeve Cuff Style",
  "sectionLabel": "Sleeves & Cuffs",
  "part": "jacket-sleeve",
  "garment": {
    "noun": "bespoke sport coat",
    "fabric": "textured wool/hopsack with visible weave"
  },
  "view": {
    "orientation": "back",
    "wearerPerspective": true,
    "confirmedByVisualInspection": true
  },
  "absence": false,
  "measured": {
    "dimensions": [],
    "angles": [],
    "counts": [],
    "shapes": [
      "slant pocket"
    ],
    "negatedShapes": [],
    "spread": [],
    "flags": [],
    "sides": [
      "both",
      "outside"
    ],
    "attributes": [],
    "supplierCodes": [],
    "unresolved": []
  },
  "illustration": {
    "path": "/images/blueprints/baoxiniao/jacket/KFAXK/X.jpg",
    "disk": "C:\\Users\\ChaseStanley\\Downloads\\files\\brand_assets\\blessed-dressed\\public\\images\\blueprints\\baoxiniao\\jacket\\KFAXK\\X.jpg",
    "exists": true,
    "remote": false
  },
  "forbidden": [
    "a generic version of this part standing in for the exact drawn option (generic-category substitution)",
    "any feature, count, or geometry borrowed from a neighboring craft option on the same field",
    "a feature that belongs on the opposite face of the garment from what this illustration shows (front/back/side confusion)"
  ],
  "excluded": null,
  "generate": true,
  "extractedAt": "2026-08-26T07:28:49.433Z"
}
