{
  "schema": "garment-spec/v1",
  "addr": "trousers > waistband > metal-adjuster > adjuster-both",
  "productId": "trousers",
  "sectionId": "waistband",
  "fieldId": "metal-adjuster",
  "optionId": "adjuster-both",
  "sourceFile": "C:\\Users\\ChaseStanley\\Downloads\\files\\brand_assets\\blessed-dressed\\data-store\\options\\trousers.json",
  "source": "json",
  "label": "Adjust Buckle",
  "description": "Side adjustment buckle.",
  "fieldLabel": "Side Adjustment Style",
  "sectionLabel": "Waistband",
  "part": "trouser-adjuster",
  "garment": {
    "noun": "pair of bespoke wool tailored trousers",
    "fabric": "fine wool trouser cloth with visible weave"
  },
  "view": {
    "orientation": "three-quarter-front",
    "wearerPerspective": true,
    "confirmedByVisualInspection": true
  },
  "absence": false,
  "measured": {
    "dimensions": [],
    "angles": [],
    "counts": [],
    "shapes": [
      "metal side-adjuster with buckle"
    ],
    "spread": [],
    "flags": [
      "side adjuster",
      "strap & buckle back",
      "buckle hardware"
    ]
  },
  "illustration": {
    "path": "/images/blueprints/factory/f2e0b944fc8f__3352__Adjust_buckle_number.jpg",
    "disk": "C:\\Users\\ChaseStanley\\Downloads\\files\\brand_assets\\blessed-dressed\\public\\images\\blueprints\\factory\\f2e0b944fc8f__3352__Adjust_buckle_number.jpg",
    "exists": true,
    "remote": false
  },
  "forbidden": [
    "a generic version of this part standing in for the exact drawn option (generic-category substitution)",
    "any feature, count, or geometry borrowed from a neighboring craft option on the same field",
    "a feature that belongs on the opposite face of the garment from what this illustration shows (front/back/side confusion)"
  ],
  "excluded": null,
  "generate": true,
  "extractedAt": "2026-07-31T04:39:46.226Z"
}
