{
  "schema": "garment-spec/v1",
  "addr": "shirt > placket > placket_button_position > btn-6",
  "productId": "shirt",
  "sectionId": "placket",
  "fieldId": "placket_button_position",
  "optionId": "btn-6",
  "sourceFile": "C:\\Users\\ChaseStanley\\Downloads\\files\\brand_assets\\blessed-dressed\\data-store\\options\\shirt.json",
  "source": "json",
  "label": "6 Buttons",
  "description": "6 front buttons — shorter length shirt.",
  "fieldLabel": "Button Count (Front)",
  "sectionLabel": "Placket",
  "part": "fin-button",
  "garment": {
    "noun": "white bespoke cotton dress shirt",
    "fabric": "crisp cotton poplin"
  },
  "view": {
    "orientation": "front",
    "wearerPerspective": true,
    "confirmedByVisualInspection": true
  },
  "absence": false,
  "measured": {
    "dimensions": [],
    "angles": [],
    "counts": [
      "6-button"
    ],
    "shapes": [],
    "negatedShapes": [],
    "spread": [],
    "flags": [],
    "sides": [
      "front"
    ],
    "attributes": [],
    "supplierCodes": [],
    "unresolved": []
  },
  "illustration": {
    "path": "/images/placket_button_position/6-buttons-not-including-collar-button.jpg",
    "disk": "C:\\Users\\ChaseStanley\\Downloads\\files\\brand_assets\\blessed-dressed\\public\\images\\placket_button_position\\6-buttons-not-including-collar-button.jpg",
    "exists": true,
    "remote": false
  },
  "forbidden": [
    "a generic version of this part standing in for the exact drawn option (generic-category substitution)",
    "any feature, count, or geometry borrowed from a neighboring craft option on the same field",
    "a feature that belongs on the opposite face of the garment from what this illustration shows (front/back/side confusion)",
    "any button count other than exactly 6"
  ],
  "excluded": null,
  "generate": true,
  "extractedAt": "2026-08-11T02:48:02.953Z"
}
