{
  "schema": "garment-spec/v1",
  "addr": "trousers > front-pockets > front-pocket-style > on-seam-pockets",
  "productId": "trousers",
  "sectionId": "front-pockets",
  "fieldId": "front-pocket-style",
  "optionId": "on-seam-pockets",
  "sourceFile": "C:\\Users\\ChaseStanley\\Downloads\\files\\brand_assets\\blessed-dressed\\data-store\\options\\trousers.json",
  "source": "json",
  "label": "On-Seam (Side Seam)",
  "description": "An on-seam (vertical) pocket hides its opening directly within the trouser's side seam, so the entry is virtually invisible from the front. This creates the cleanest, most formal silhouette with no line interrupting the front of the trouser, though access is slightly less convenient than a slant. It is the traditional choice for dress and suit trousers.",
  "fieldLabel": "Front Pocket Style",
  "sectionLabel": "Front & Pockets",
  "part": "trouser-front-pocket",
  "garment": {
    "noun": "pair of bespoke wool tailored trousers",
    "fabric": "fine wool trouser cloth with visible weave"
  },
  "view": {
    "orientation": "three-quarter-front",
    "wearerPerspective": true,
    "confirmedByVisualInspection": true
  },
  "absence": false,
  "measured": {
    "dimensions": [],
    "angles": [],
    "counts": [],
    "shapes": [
      "slant pocket",
      "on-seam (side-seam) pocket"
    ],
    "spread": [],
    "flags": []
  },
  "illustration": {
    "path": "/images/blueprints/factory/a1a8d4d2842a__3130__Sideseam.jpg",
    "disk": "C:\\Users\\ChaseStanley\\Downloads\\files\\brand_assets\\blessed-dressed\\public\\images\\blueprints\\factory\\a1a8d4d2842a__3130__Sideseam.jpg",
    "exists": true,
    "remote": false
  },
  "forbidden": [
    "a generic version of this part standing in for the exact drawn option (generic-category substitution)",
    "any feature, count, or geometry borrowed from a neighboring craft option on the same field",
    "a feature that belongs on the opposite face of the garment from what this illustration shows (front/back/side confusion)"
  ],
  "excluded": null,
  "generate": true,
  "extractedAt": "2026-07-31T04:55:13.619Z"
}
