{
  "schema": "garment-spec/v1",
  "addr": "shirt > placket > first_button_distance > fbd-5",
  "productId": "shirt",
  "sectionId": "placket",
  "fieldId": "first_button_distance",
  "optionId": "fbd-5",
  "sourceFile": "C:\\Users\\ChaseStanley\\Downloads\\files\\brand_assets\\blessed-dressed\\data-store\\options\\shirt.json",
  "source": "json",
  "label": "5 cm",
  "description": "First button 5 cm from neckline.",
  "fieldLabel": "First Button Distance",
  "sectionLabel": "Placket",
  "part": "shirt-placket",
  "garment": {
    "noun": "white bespoke cotton dress shirt",
    "fabric": "crisp cotton poplin"
  },
  "view": {
    "orientation": "front",
    "wearerPerspective": true,
    "confirmedByVisualInspection": true
  },
  "absence": false,
  "measured": {
    "dimensions": [
      "5 cm"
    ],
    "angles": [],
    "counts": [],
    "shapes": [],
    "negatedShapes": [],
    "spread": [],
    "flags": [],
    "sides": [],
    "attributes": [],
    "supplierCodes": [],
    "unresolved": []
  },
  "illustration": {
    "path": "/images/first_button_distance/5cm.jpg",
    "disk": "C:\\Users\\ChaseStanley\\Downloads\\files\\brand_assets\\blessed-dressed\\public\\images\\first_button_distance\\5cm.jpg",
    "exists": true,
    "remote": false
  },
  "forbidden": [
    "a generic version of this part standing in for the exact drawn option (generic-category substitution)",
    "any feature, count, or geometry borrowed from a neighboring craft option on the same field",
    "a feature that belongs on the opposite face of the garment from what this illustration shows (front/back/side confusion)"
  ],
  "excluded": null,
  "generate": true,
  "extractedAt": "2026-08-27T02:37:16.364Z"
}
