{
  "schema": "garment-spec/v1",
  "addr": "suit-3pc > Trousers-waistband > extension-length > ext-len-13",
  "productId": "suit-3pc",
  "sectionId": "Trousers-waistband",
  "fieldId": "extension-length",
  "optionId": "ext-len-13",
  "sourceFile": "C:\\Users\\ChaseStanley\\Downloads\\files\\brand_assets\\blessed-dressed\\data-store\\options\\suit-3pc.json",
  "source": "json",
  "label": "13 cm",
  "description": "13 cm waistband extension — a long Florentine tab crossing deep past center front; maximum sartorial presence.",
  "fieldLabel": "Extension Length",
  "sectionLabel": "Trousers — Waistband",
  "part": "trouser-extension-length",
  "garment": {
    "noun": "pair of bespoke wool tailored trousers",
    "fabric": "fine wool trouser cloth with visible weave"
  },
  "view": {
    "orientation": "front",
    "wearerPerspective": true,
    "confirmedByVisualInspection": true
  },
  "absence": false,
  "measured": {
    "dimensions": [
      "13 cm"
    ],
    "angles": [],
    "counts": [],
    "shapes": [],
    "negatedShapes": [],
    "spread": [],
    "flags": [
      "tab fastening"
    ],
    "sides": [
      "center",
      "front"
    ],
    "attributes": [],
    "supplierCodes": [],
    "unresolved": []
  },
  "illustration": {
    "path": "/images/blueprints/factory/8f065c084861__K.jpg",
    "disk": "C:\\Users\\ChaseStanley\\Downloads\\files\\brand_assets\\blessed-dressed\\public\\images\\blueprints\\factory\\8f065c084861__K.jpg",
    "exists": true,
    "remote": false
  },
  "forbidden": [
    "a generic version of this part standing in for the exact drawn option (generic-category substitution)",
    "any feature, count, or geometry borrowed from a neighboring craft option on the same field",
    "a feature that belongs on the opposite face of the garment from what this illustration shows (front/back/side confusion)"
  ],
  "excluded": null,
  "generate": true,
  "extractedAt": "2026-08-27T02:36:34.637Z"
}
