{
  "schema": "garment-spec/v1",
  "addr": "sport-coat > lapel > lapel-style > lapel-shawl",
  "productId": "sport-coat",
  "sectionId": "lapel",
  "fieldId": "lapel-style",
  "optionId": "lapel-shawl",
  "sourceFile": "C:\\Users\\ChaseStanley\\Downloads\\files\\brand_assets\\blessed-dressed\\data-store\\options\\sport-coat.json",
  "source": "json",
  "label": "Shawl Lapel",
  "description": "Shawl lapel — no notch, no peak, no gorge interruption. Collar and lapel form one continuous spline drawn from the center-back neck to the front edge, with a radius progression of 2 cm, 4 cm and 7 cm blended continuously. Flowing, luxurious; formal eveningwear.",
  "fieldLabel": "Lapel Style",
  "sectionLabel": "Lapel",
  "part": "jacket-lapel",
  "garment": {
    "noun": "bespoke sport coat",
    "fabric": "textured wool/hopsack with visible weave"
  },
  "view": {
    "orientation": "front",
    "wearerPerspective": true,
    "confirmedByVisualInspection": true
  },
  "absence": false,
  "measured": {
    "dimensions": [
      "2 cm",
      "4 cm",
      "7 cm"
    ],
    "angles": [],
    "counts": [],
    "shapes": [
      "shawl lapel"
    ],
    "negatedShapes": [],
    "spread": [],
    "flags": [],
    "sides": [
      "center",
      "front",
      "back"
    ],
    "attributes": [],
    "supplierCodes": [],
    "unresolved": []
  },
  "illustration": {
    "path": "/images/blueprints/baoxiniao/jacket/REQCL/D.jpg",
    "disk": "C:\\Users\\ChaseStanley\\Downloads\\files\\brand_assets\\blessed-dressed\\public\\images\\blueprints\\baoxiniao\\jacket\\REQCL\\D.jpg",
    "exists": true,
    "remote": false
  },
  "forbidden": [
    "a generic version of this part standing in for the exact drawn option (generic-category substitution)",
    "any feature, count, or geometry borrowed from a neighboring craft option on the same field",
    "a feature that belongs on the opposite face of the garment from what this illustration shows (front/back/side confusion)"
  ],
  "excluded": null,
  "generate": true,
  "extractedAt": "2026-08-26T07:29:01.712Z"
}
