{
  "schema": "garment-spec/v1",
  "addr": "suit-2pc > Trousers-waistband > waistband-extension > ext-no-hook",
  "productId": "suit-2pc",
  "sectionId": "Trousers-waistband",
  "fieldId": "waistband-extension",
  "optionId": "ext-no-hook",
  "sourceFile": "C:\\Users\\ChaseStanley\\Downloads\\files\\brand_assets\\blessed-dressed\\data-store\\options\\suit-2pc.json",
  "source": "json",
  "label": "No Extension, Hook Only",
  "description": "No extension tab, hook closure only.",
  "fieldLabel": "Extension & Closure",
  "sectionLabel": "Trousers — Waistband",
  "part": "trouser-extension",
  "garment": {
    "noun": "pair of bespoke wool tailored trousers",
    "fabric": "fine wool trouser cloth with visible weave"
  },
  "view": {
    "orientation": "front",
    "wearerPerspective": true,
    "confirmedByVisualInspection": true
  },
  "absence": false,
  "measured": {
    "dimensions": [],
    "angles": [],
    "counts": [
      "1-hook"
    ],
    "shapes": [
      "no extension tab — closure flush to the band"
    ],
    "negatedShapes": [],
    "spread": [],
    "flags": [
      "tab fastening",
      "hook-only closure"
    ],
    "sides": [],
    "attributes": [],
    "supplierCodes": [],
    "unresolved": []
  },
  "illustration": {
    "path": "/images/blueprints/remote/b87e70d16b98__3410.jpg",
    "disk": "C:\\Users\\ChaseStanley\\Downloads\\files\\brand_assets\\blessed-dressed\\public\\images\\blueprints\\remote\\b87e70d16b98__3410.jpg",
    "exists": true,
    "remote": false
  },
  "forbidden": [
    "a generic version of this part standing in for the exact drawn option (generic-category substitution)",
    "any feature, count, or geometry borrowed from a neighboring craft option on the same field",
    "a feature that belongs on the opposite face of the garment from what this illustration shows (front/back/side confusion)",
    "any hook count other than exactly 1"
  ],
  "excluded": null,
  "generate": true,
  "extractedAt": "2026-08-15T21:52:15.148Z"
}
